{
  "schema_version": "0.1.0",
  "id": "7c1d2e3f-4a5b-4c6d-8e7f-90a1b2c3d4e5",
  "server": "gb",
  "season": 42,
  "rank_n": 158,
  "damage": 241.07,
  "read_at": "2026-10-31T21:05:00Z",
  "submitted_at": "2026-10-31T21:06:40Z",
  "client": {
    "turnstile": true,
    "rate_key": "0d1e2f3a4b5c6d7e8f90a1b2c3d4e5f60718293a4b5c6d7e8f9a0b1c2d3e4f50"
  }
}
